Eggroll Games,,http://eggrollgames.com/,LLC - Limited Liability,6/6/2012,,,,,826 Bitting Hall Dr.,Rural Hall,North Carolina,27045,Forsyth,contact@eggrollgames.com,,"""Winston-Salem based Eggroll Games develops delightful and educational children's apps which with more than 8 million downloads have found their way into homes and schools around the world. Started in 2011, the company operates with a small footprint with just the two co-founders and six other part-time contractors. Eggroll Games currently offers 72 apps on the Apple App Store,Google Play store and Amazon for mobile, tablet and set-top platforms."" (website Jan 2024)","NC Secretary of State website status is ""Current-Active;"" NC Annual Report Filed on 2/22/23; Active website - Jenny (1/3/2024) NC Secretary of State website status is ""Current-Active"", AR filed 3/7/24, active website, address updated, 5-10-24 - John.",,,,,
ELDEC Pharmaceuticals Inc,,https://eldecpharmaceuticals.com/,C Corporation,11/13/2017,Robert Tarran,Richard J. Shea,Robert Tarran,,1801 Fayetteville St.,Durham,North Carolina,27707,Orange,,(919) 219-1113,"""Lung dysfunction is the major cause of morbidity and mortality in Cystic Fibrosis (CF) patients. While the significance of anti-inflammatory treatment was realized in the 1990s, there remains a lack of drug therapies aimed toward treating the powerful and relentless inflammation in CF patients. Eldec Pharmaceuticals is dedicated to meet the urgent need for an effective anti-inflammatory therapeutic to treat chronic lung disease in CF patients. Inhibition of Orai1-induced Ca2+ influx has been proposed as a therapy for reducing inflammation. We have solved SPLUNC1's crystal structure and identified a domain called the a6 region that binds the Orai1 calcium channel. Thus, replacement of SPLUNC1 with this peptide may serve as a therapeutic approach to reduce inflammation in CF patients. We have designed new a6 peptide mutants that have improved stability in CF sputum without binding to mucus. We are evaluating the ability of these peptides to control cytosolic calcium levels via inhibition of Orai1. Finally, we are using mice infected with Pseudomonas aeruginosa to determine if the peptides are capable of controlling inflammation. As mentioned before, novel anti-inflammatory therapy is crucial and urgently needed to treat inflammation in CF patients.""","incorporated DE, NC Mailing Address: 6607 Manor Hill Ct. Chapel Hill, NC 27516","NC annual report 4/12/19. JL 7/12/19. Annual report 6/18/20; JL 6/21/20. AR 4/7/21- JL 7/24/21. No website found, NC Sec State website status is ""Current - Active"", NC AR - 4-13-22, 6-29-22 - Tiffany Current - Active on NC Site, last NC Annual Report Filed 4/13/22, still no website found (Juliana, 5/24/23) ""Active- Not Current"" on NC Site, last NC Annual Report Filed 4/13/22, address updated and website added, website active (John 5/10/24).",,,,
Elipsys LLC,,https://www.elipsystech.com/,LLC - Limited Liability,8/26/2021,Adam Kiefer,,Adam Kiefer,,110 Burham Court,Apex,North Carolina,27502,Wake,info@elipsystech.com,(513) 315-7905,Artificial Intelligence/Enhancing athletic training,incorporated NC,"No website found, NC Sec State website status is ""Current - Active"", NC AR - 4-15-22, 6-29-22 - Tiffany Current - Active on NC Site, NC Annual Report Filed 4/15/23, no website found (Juliana, 5/24/23) NC Secretary of State website status is ""Current-Active"", AR filed 4/15/23, website/email updated, active website, 5-10-24 - John.",,,,
Elite Innovations LLC,Carolina Breathalyzer Service LLC; Military Discounters LLC,http://eliteinnovationsllc.com/,LLC - Limited Liability,8/4/2009,Andrew Williams,,,,"201 N Front Street, M107",Wilmington,North Carolina,28401,New Hanover,customerservice@eliteinnovationsllc.com,(910) 782-2481,"""Elite Innovations is Wilmington NC?s premier product development firm and first and only ?Makerspace.? So what is a Makerspace? A Maker Space is a one-stop-shop location for inventors, entrepreneurs, inventors, and small businesses to turn their ideas into tangible products. At Elite Innovations, you have access to all of our tools and equipment, as well as our product design, prototyping, and manufacturing expertise. We understand the product development process and can help you take those critical first steps in turning and idea into reality.""","incorporated NC; annual report 6/9/2015 (Cindy, 5/12/2017)","Recent news: CEO is closing down Elite Innovations. See Press section. Website still active. Last annual report 6/21/2017. Jen Lai (6/7/19). NC Sec State says its ""dissolved"" on 10/11/19, although website still active. JL, 6/21/20. Website no longer active. JL 7/24/21.","Liquidation, close down",10/11/2019,,
Emergi Foundation,Emergi; Emergi Solar,https://www.emergi.eco/,501c,10/1/2019,Eric Scheier,,,,500 Westover Dr,Sanford,North Carolina,27330-8941,Lee,eric.scheier@unc.edu,(919) 412-3602,"Emergi provides sustainability as a service by connecting people to impactful projects in their communities and around the world. Currently, we allow our members to upgrade their homes to free solar power, go carbon neutral, and contribute to poverty alleviation by supporting local solar projects.","EIN 84-2205410; registered 501(c)(3) as Emergi Foundation (Patrick, 4/14/2020) Website is active, IRS website lists most recent Form 990-N filed for Tax Year 2018, 6-29-22 - Tiffany Tax exempt status revoked 5/8/23 on IRS website, website still active (Juliana 5/24/23) ""Current- Active"" on NC SoS website, EIN: 84-2205410, last form 990 filed 2018, tax exempt status revoked on IRS website due to not submitting additional form 990s, website active (John 5/10/24).",,,,,
Emergo Therapeutics Inc,,http://emergotherapeutics.com/,C Corporation,9/1/2016,Robin Hyde-DeRuyscher,,,,"6208 Fayetteville Road, Suite 104",Durham,North Carolina,27713,Durham,,(919) 306-2101,,,,,,,
"Emervax, Inc.",,www.emervax.com,C Corporation,5/5/2021,Alexander V. Kabanov,,Alexander V. Kabanov,,2558 Estrada Dr,League City,Texas,77573-2073,,alex@emervax.com,,"""Emervax was founded by visionary leaders in RNA biochemistry and infectious diseases founded Emervax to chart a new course in vaccination. Leveraging circRNA technology, advanced purification methods and innovative delivery strategies, our focus is creating groundbreaking vaccines against both viruses and difficult to treat cancers."" (website, 6-18-24)","Active and incorporated in DE & Texas; Texas SOS File Number: 0804053135 (Tiffany, 6-18-24)",,,,,
EmitBio Inc,subsidiary of KnowBio,https://www.emitbio.com/,C Corporation,1/29/2020,F Neal Hunter,,Mark Schoenfisch,,615 Davis Dr Suite 800,Morrisville,North Carolina,27560,Wake,info@emitbio.com,(919) 321-1734,"""EmitBio? is a life science company using the precise delivery of light to stimulate, protect, regenerate and heal the body through light therapy."" (website, 2/3/2021)","incorporated DE 1/29/2020, in corporated NC 1/28/2021 The website is active, NC Sec State website status is ""Current - Active"", NC AR - 4-14-22, 6-29-22 - Tiffany.","Current - Active on NC Site, last NC Annual Report Filed 4/14/22, website active (Juliana, 5/24/23) NC Secretary of State website status is ""Active - Not Current"", last annual report filed 4-14-22, email/address updated, active website, 4-10-24 - John.",,,,
Empiric Systems LLC,,,LLC - Limited Liability,12/11/2001,Mark Janas,Peter Gratale,,,3800 Paramount Pkwy Ste 130,Morrisville,North Carolina,27560,Wake,,(919) 465-0222,"Empiric Systems provides web-based radiology information, picture archiving and communication, and billing-system software solutions to medical imaging facilities. Based in Morrisville, NC, Empiric Systems has operated since 2008 as a subsidiary of Fujifilm Medical Systems USA.",founders both have BS in Radiologic Science (SOM),,Acquisition,7/16/2010,,
"Empower: Educate & Inspire, Inc.",Life Skills - Positive Psychology; Bamboo; Empower; Bamboo Academy,https://www.empowereducateinspire.org/,501c,7/1/2015,Caroline M Kennedy,Joseph R Nail,,,6101 W 149TH ST,Overland Park,Kansas,66223-1108,,empowernp@gmail.com,,Empower: Educate & Inspire is a nonprofit organization dedicated to teaching youth how to create meaningful change in the world and in their own lives.,"incorporated before student founder started at UNC, but student participating in CUBE cohort to reimagine the startup; no incorporation data found 6/8/2018, project is part of the 2017-2018 CUBE 4.0 program","No incorporation data found. Jen Lai 7/7/19. No other data found besides website. JL 6/21/20. Website not active JL 7/25/21. The website is still not active, EIN: 47-4380915. On the IRS website, has a revocation date of 05-15-2018, and does not have an exemption reinstatement date listed. Marking inactive per the founder's linkedIn (July 2019), 6-29-22 - Tiffany","Liquidation, close down",7/1/2019,,
"EMPOWERment, Inc",,https://www.empowermentinc-nc.org/,501c,3/20/1996,Delores Bailey,Myles Presler,,,109 N. Graham St.,Chapel Hill,North Carolina,27516,Orange,empowermentincnc@gmail.com,(919) 967-8779,"""EmPOWERment, Inc. was established not only to build homes, but also to build lives. In order to raise community awareness and dialogue, a multi-pronged and ambitious mission was created for the growing organization."" (Website, 2/15/2016)","Website is active, NC Sec State website status is ""Current - Active"". EIN: 56-1965772, IRS website lists most recent Form 990 filed for Tax Year 2018, 6-29-22 - Tiffany.","Current - Active on NC site, 501c, last tax filing with the IRS was 2018, website active (Juliana, 5/24/23) ""Current- Active"" on NC SoS website, EIN: 56-1965772, last form 990 filed 2021, website active, website/email updated (John 5/11/24).",,,,
EmpowerRT,,https://empowerrt.wordpress.com/about/,LLC - Limited Liability,3/23/2017,Sha Chang,,Sha Chang,,108 Boulder Ln,Chapel Hill,North Carolina,27514,Orange,empower.rt@gmail.com,(919) 260-0720,"""Our solution works with teletherapy units which emit uniform radiation to transform RT treatment into modern IMRT treatment. Our solution is clinically-proven, time-efficient, low toxicity, spares healthy tissues from radiation and is affordable!"" (company website, (12/31/2017)","incorporated NC. Per Cindy: I had to create ICS example/projection metrics during its strategic planning some years ago. They are examples of interdisciplinary founded startups, not ICS per se.","Annual report 4/17/2018 (Jen Lai 6/7/19) NC Annual report filed 12/1/19, JL (6/21/20). AR 3/31/21 JL. Website is active, NC Sec State website status is ""Active - Not Current"", 6-29-22 - Tiffany Dissolved on NC website, destruction filing 2/17/23, website still active (Juliana 5/16/23) ""Dissolved"" on NC website, website still active, founder's linkedin suggests company may still be active (John 5/11/24).",,,,
Enci Therapeutics Inc,,,C Corporation,9/24/2009,Nancy Demore,Cam Patterson,Cam Patterson,Nancy Demore,1461 Appling Drive,Mount Pleasant,South Carolina,29464,,,(919) 949-4771,"Enci Therapeutics is developing a monoclonal antibody to block the activity of SFRP2: a newly discovered protein expressed in a wide number of human tumors, that promotes angiogenesis and tumor progression in animal models.","incorporated DE, NC; NC incorporated suspended, may be revoked 12/23/2016 (no annual report since 2014) No website found, the company is still active according to the co-founder's linkedIn page, 6-29-22 - Tiffany Incorporated in SC filed 11/12/2015, in Good Standing, still active according to the co-founder's linkedIn page, 7-21-23 - Tiffany Per Cindy: I had to create ICS example/projection metrics during its strategic planning some years ago. They are examples of interdisciplinary founded startups, not ICS per se. ""Suspended"" in NC, registered in DE, ""good standing"" in SC, no website found (John 5/11/24).",,,,,
Enfuego Therapeutics Inc,,,C Corporation,2/6/2019,Chad Pecot,,Chad Pecot,,37 Linda Lee Cir,Pittsboro,North Carolina,27312-9815,Chatham,,(615) 305-3955,"Enfuego Therapeutics is a biotech company developing novel RNA interference-(RNAi)-based and antisense oligo therapeutics for ?non-druggable? oncogenes such as KRAS. The team has developed therapies that potently bind to mutant KRAS sequences while sparing wild-type KRAS and is optimizing different delivery platforms including ligand-conjugated approaches. Enfuego Therapeutics was founded by Chad Pecot, associate professor at the UNC Lineberger Comprehensive Cancer Center.",incorporated DE; CEL 6/2020 (per Kyle Bartholomew),"NC AR 3/9/21- JL. No website found, NC Sec State website status is ""Current - Active"", 6-29-22 - Tiffany Current - Active on NC Site, NC Annual Report Filed 2/18/23, no website found (Juliana, 5/24/23) NC Secretary of State website status is ""Current-Active"", AR filed 3/28/24, no website found, 5-11-24 - John.",,,,
Engine Enterprises,"Engine Enterprises, LLC",http://engineenterprises.com/,,3/18/2009,Brant Wansley,,,,102 Rose Walk Lane,Carrboro,North Carolina,27510,Orange,bwansley@engineenterprises.com,(704) 236-8977,"""We collaborate with you to develop sound, creative ideas rooted in the Essential Idea to simplify and differentiate your brand, enabling it to soar."" (Startup website, January 2024)","NC Secretary of State website status is ""Current-Active;"" NC Annual Report Filed on 10/7/22; Active website - Jenny (12/29/2023) NC Secretary of State website status is ""Current-Active"", AR filed 10/7/22, website active, email added, 5-11-24 - John.",,,,,
enrollmentFUEL LLC,"Kookoolamonga, L.L.C.",http://www.enrollmentfuel.com/,LLC - Limited Liability,4/1/2015,Mike Wesner,,,,136 East Rosemary Suite 100,Chapel Hill,North Carolina,27514,Orange,marketing@enrollmentfuel.com,(919) 228-8122,We help 20 private higher education clients with enrollment growth by using marketing and science to engage potential students.,"incorporated NC, annual report 4/17/2018 Mailing Address: 144 W 2nd Street Washington, NC 27889-4982","Annual report 4/13/19- Jen Lai (6/7/19); NC annual report 3/31/20, JL (6/21/20). NC AR 4/13/21 JL. The website is active, NC Sec State website status is ""Current - Active"", NC AR - 3-3-22, 6-29-22 - Tiffany. Current - Active on NC Site, NC Annual Report Filed 4/17/23, website active (Juliana, 5/24/23) NC Secretary of State website status is ""Current-Active"", AR filed 4/9/24, website active, email updated, 5-11-24 - John.",,,,
eNsourcing LLC,,www.ensourcing.com,LLC,8/11/2015,Manuel Aguirre,,,,"3110 Edwards Mill Road, Suite 300",Raleigh,North Carolina,27612,Wake,,(919) 410-6268,"At eNsourcing, we provide small and medium-sized businesses with technology and business solutions to help them change the world. We offer technology solutions for small and medium sized business, at affordable prices. We compete by leveraging our extensive international presence to offer competitive prices and full accountability. We offer the following products / services: - Web Development - Mobile App Development - eCommerce - Information Security Services - Cloud Hosting Solutions - Cloud Infrastructure Solutions - Social Media Management - Website Language Translation Services - Management and Business Consulting","Incorporated in NC, dissolved in 2019, (Tiffany, 8-18-23)",,"Liquidation, close down",10/4/2019,,
Entegrion Inc,Hemocellular Therapeutics,http://www.entegrion.com/,C Corporation,3/29/2004,Joe DaCorta,Thomas Fischer,Thomas Fischer,,"4819 Emperor Boulevard, Suite 400",Durham,North Carolina,27703,Durham,info@entegrion.com,(919) 536-1500,Entegrion develops biological and medical-device technologies to enhance the safety and availability of the human blood supply. Entegrion has developed a lyophilized blood substitute product which is far more stable than stored human platelets and effective at stopping bleeding.,"incorporated DE, NC; annual report NC 4/11/2017 In October 2014, Entegrion terminated its license with UNC for the Stasix IP referenced in the TBJ article. We can still consider them a UNC Technology startup (we have equity and another license for different IP around a bandage). Therefore we are a little hesitant for us to tout this Stasix grant as a UNC win since they terminated their license right when they got the award. (OTD, 11/7/2014)","Annual report 1/9/19- JL 6/7/19. Annual report 10/22/19 JL (6/21/20) The website is active, NC Sec State website status is ""Current - Active"", NC AR - 3-24-22, 6-29-22 - Tiffany. Current - Active on NC Site, NC Annual Report Filed 3/6/23, website active (Juliana, 5/24/23) NC Secretary of State website status is ""Current-Active"", AR filed 1/23/24, website active, 5-11-24 - John.",,,,
Envisia Therapeutics Inc,,https://www.pappas-capital.com/portfolio/envisia-therapeutics/,,4/29/2013,Eric Linsley,,,,PO Box 110065,Research Triangle Park,North Carolina,27709,Durham,info@envisiatherapeutics.com,(919) 973-1440,"Envisia Therapeutics, formed by Liquidia Technologies in 2013, is a privately held biotechnology company focused on the development of novel ocular therapies. Envisia is leveraging the unique and powerful properties of the PRINT platform to develop therapies for a variety of ocular conditions, the most advanced of which is ENV515, for the treatment of glaucoma.","incorporated DE; also filed in NC 10/24/2013 Physical address: 419 Davis Drive, Suite 100, Morrisville, NC 27560 not reporting as Tech startup to AUTM - sub-license from Liquidia (Michael/Cindy, 10/25/2016) Mailing Address: 2626 Glenwood Avenue, Suite 550 Raleigh, NC 27608","Website no longer active. Last annual report was 4/5/18. Jen Lai (6/7/19). Annual report filed 4/20/20 in NC and active in DE, but website not active second year in row. JL (6/21/20). Annual report 6/10/21 JL, website not active, part of Pappas Capital Group portfolio. Website is active now, NC Sec State website status is ""Current - Active"", NC AR - 3-2-22, 6-30-22 - Tiffany. Current - Active on NC Site, NC Annual Report Filed 2/2023, website active (Juliana, 5/24/23) NC Secretary of State website status is ""Current-Active"", AR filed 2/10/24, no official website found, 5-11-24 - John.",,,,
Enzerna Biosciences Inc,Enzerna Biosciences LLC,https://www.enzerna.com/,C Corporation,10/27/2014,Joseph Ruiz,Zefeng Wang,Zefeng Wang,,5151 McCrimmon Pkwy Suite 240,Morrisville,North Carolina,27560,Wake,info@enzerna.com,(919) 307-6468,"Enzerna Biosciences has developed a proprietary platform technology to engineer sequence-specific RNA endonucleases. It is designed to treat disease by degrading toxic RNA in a programmable way distinct from CRISPR/Cas DNA editing technology. The technology is particularly suited to address nucleotide expansion disorders such as Huntington?s Disease and myotonic dystrophy. Enzerna Biosciences was founded by Zefeng Wang, associate professor in the pharmacology department at the UNC School of Medicine; Gene Yeo and Jonathan Scolnick.","Enzerna Biosciences LLC; reincorporated as Inc in NC 5/18/2016 Moved from 617 Hutton Dr, Suite 200, Raleigh, NC 27606, Wake County to KickStart Accelerator (Genome Sciences) in late Dec 2019) Mailing Address: 1800 North Greene Street Ste E Greenville, NC 27834 Per Cindy: I had to create ICS example/projection metrics during its strategic planning some years ago. They are examples of interdisciplinary founded startups, not ICS per se.","Annual report filed 4/8/19. JL 6/7/19. Annual report 4/8/20, JL (6/21/20). AR 3/9/21. The website is not working, NC Sec State website status is ""Current - Active"", NC AR - 4-8-22, 6-30-22 - Tiffany. Current - Active on NC Site, NC Annual Report Filed 3/29/23, website active (Juliana, 5/24/23) NC Secretary of State website status is ""Current-Active"", AR filed 4/11/24, website active, 5-11-24 - John. Address updated.",,,,
ENZI Footwear,"Enzifootwear.com, ENZI",https://enzi.com/,LLC - Limited Liability,8/18/2011,Samuel M Imende,,,,Bole Rd,Addis Ababa,,,,info@enzi.com,,"""ENZI is an up and coming brand that features premium casual footwear and high quality apparel made in East Africa. ""It also happens to be the source of world- renowned materials such as Ethiopian high grade leathers, woven fabrics, organic cotton and traditional crafts. Designing our products at the source of these materials gives us a unique opportunity to take familiar/classic silhouettes and develop our own inspired collections. ""ENZI is designed for the fashion-conscious, multicultural consumer, which is a reflection of who we are as a team. Our shoes fill the gap in the market between expensive formal footwear and low-cost trainers with versatile designs that can be paired with a range of wardrobe styles. ""Designing at the source gives us the freedom to create a truly inspiring brand!"" (LinkedIn page, 1/11/2016)",Note: The company is operating in Ethiopia; Incorporation information: Department of State of Delaware File Number 5026950,"The website is active, 6-30-22 - Tiffany. Incorporated in DE, website active (Juliana, 5/24/23) Registered in DE file no. 5026950, website active (John 5/11/24).",,,,
EpiCypher Inc,,https://www.epicypher.com/,C Corporation,1/18/2012,Sam C Tetlow,Zu-Wen Sun,Brian Strahl,,6 Davis Drive,Durham,North Carolina,27709,Durham,info@epicypher.com,(855) 374-2461,EpiCypher develops and manufactures novel tools and reagents for epigenetics drug development and chromatin biology research.,"Previous address: 8000 Research Forest Dr Suite 115-271 Woodlands, Texas 77382; incorporated DE and NC Per Cindy: I had to create ICS example/projection metrics during its strategic planning some years ago. They are examples of interdisciplinary founded startups, not ICS per se.","Annual report 3/3/20 JL (6/21/20). AR 4/2/21 JL. The website is active, NC Sec State website status is ""Current - Active"", NC AR - 2-24-22, 6-30-22 - Tiffany. Current - Active on NC Site, NC Annual Report Filed 2/27/23, website active (Juliana, 5/24/23) NC Secretary of State website status is ""Current-Active"", AR filed 3/28/24, website active, 5-11-24 - John.",,,,
Epidemico Inc,Epidemico LLC,http://www.epidemico.com/,C Corporation,10/26/2007,John Brownstein,Clark Freifeld,,,50 Milk Street 20th Floor,Boston,Massachusetts,02109,,info@epidemico.com,,"""So you have a ton of unstructured data and want to extract insight. Or, you need to bring data into the cool analytics platform you have already built. We understand that your needs are unique, which is why we built a completely modular infrastructure allowing us to snap together components of our capabilities to provide you a tailored solution. We work with you to select from our capabilities, apply it to your specifications, then provide the output you need - whether it?s a private API into which you can make unlimited calls, or a customized real-time visualization."" (website, 11/10/2016)","incorporated MA, then DE Michelle Johnson of Gillings reported on 4/12/2017 that this venture is still active No longer reported as a separate entity in business databases, only with Booz Allen Hamilton",,Merger,10/30/2014,,
Epigenos Biosciences Inc,,,C Corporation,10/29/2018,Nate Hathaway,,Nate Hathaway,,128 Hunters Ridge Rd,Chapel Hill,North Carolina,27517,Orange,,(919) 454-8801,"Epigenos Biosciences is developing dCas9 Chemical Epigenetic Modifiers (CEM)-based therapies for cancer and rare diseases. They have developed a new platform technology to reversibly use endogenous cellular machinery to activate (or repress) any gene using novel bifunctional molecule sets. The core technology allows epigenetic sculpting with CEMs and is dose dependent and reversible. The technology was developed out of the laboratory of Nate Hathaway, assistant professor at the UNC Eshelman School of Pharmacy.","incorporated DE CELA in progress May 2020 (Champ, 5/11/2020) Mailing Address: 1800 N Greene St Ste E Greenville, NC 27834","Annual report 3/9/21 JL. No website found, NC Sec State website status is ""Current - Active"", NC AR - 4-8-22, 6-30-22 - Tiffany. Current - Active on NC Site, NC Annual Report Filed 3/29/23, no website found (Juliana, 5/24/23) NC Secretary of State website status is ""Current-Active"", AR filed 4/11/24, no website found, 5-11-24 - John.",,,,
Epiodyne Inc,,https://epiodyne.com/,C Corporation,4/15/2016,Bryan L Roth,,Bryan L Roth,,953 Indiana Street,San Francisco,California,94107,,info@epiodyne.com,,"""Breakthrough drugs for validated targets."" (website, 2/5/2018)",incorporated DE Founded by UCSF researchers; includes UNC IP (licensed) https://www.biocentury.com/bc-innovations/targets-mechanisms/2016-09-01/how-epiodyne-aims-make-opioids-safer,"Website is active, CA Sec State website status is ""Active"", CA Statement of Information filed 3-8-21, 6-30-22 - Tiffany. Active on CA website, but missed 2022 deadline for statement of information and last SOI filing was in 2021 (Juliana, 5/24/23) ""Active"" on CA website, website active (John 5/11/24).",,,,
Epione.ai,Amari.AI Incorporated;Amari.ai Inc,http://epione.ai/,C Corporation,9/8/2017,Eric Kern,Bill Nelson,,,114 Parkridge Ave,Chapel Hill,North Carolina,27517,Orange,,,"By leveraging existing natural language and video processing, we are able to create an intelligent agent for the individual that will assist them in their daily lives. Our initial focus is on building an agent for each doctor that will assist them with data input into electronic medical systems by providing a natural language input and control system. The goal will be to increase doctor patient eye contact and personal interaction while making the technology natural and in the background.","no website and/or incorporation data found. cannot follow JL's supposed connection with Amari.AI. (Patrick, 1/12/2021)",Website is no longer active. 6/8/19 Jen Lai. Website no longer active second year JL 6/21/20. Found Amari.ai incorporated in CO with ID: 20171693178. Strongly suspect this is the company. JL (6/21/20),"Liquidation, close down",1/1/2021,,
