Railcare Health,,https://railcarehealth.com/,501c,5/12/2017,Kevin Travia,,,,7600 Malbec Ct,Kernersville,North Carolina,27284-6724,Forsyth,eric.casper@railcarehealth.com,(910) 258-4238,"Established since 2016, we are a free, mobile clinic that provides healthcare to the underinsured and uninsured in North Carolina. Using an interdisciplinary model, we are able to cater healthcare to serve the broadest range of patients. (website, 7/26/2019)","incorporated NC, EIN 82-1693813 railcarehealth.com registration active, recent activity on social profiles (Patrick, 6/29/2022","The website is active, NC SoS status as ""Current - active,"" latest Form 990 2021. Address is correct. (Mackenzie, 6/16/23) NC Secretary of State website status is ""Current-Active"", EIN: 82-1693813, form 990-N filed 2023, active website (John 5/20/24). Phone number on facebook is (919) 289-9108, email updated.",,,,
RainBio Inc,,https://rainbio.us/,C Corporation,6/12/2020,Matthew Hirsch,Chengwen Li,Matthew Hirsch,Chengwen Li,8628 Valley Brook Dr,Raleigh,North Carolina,27613,Wake,info@rainbio.us,9194123680,RainBio is the only ocular gene therapy pioneer focused on blindness in the cornea. Our adeno-associated virus (AAV) vector gene therapy can directly correct cornea cellular function to maintain or restore vision in patients at risk of blindness from a number of diseases.,"registration active, 2022 AR filed (Patrick, 6/29/2022), incorporated NC","AR 3/25/21- JL. The website is active, NC SoS status as ""Current - active,"" latest annual report 3/2/2023. Address and contact information are correct. (Mackenzie, 6/16/23) NC Secretary of State website status is ""Current-Active"", NC Annual Report 3/28/24, active website (John 5/20/24).",Acquisition,3/30/2022,,
Raise Technologies,POLI,https://raisetech.co/,LLC - Limited Liability,7/8/2019,Ryan Wallace,,,,173 East Franklin St,Chapel Hill,North Carolina,,Orange,,,"""Raise Technologiesis building a marketplace for entrepreneurial and social ventures to identify and access funding opportunities from institutions, foundations, donors, and angel investors by delivering better connections and insights through Artificial Intelligence and Machine Learning."" (Launch Chapel Hill website, 2/25/2020)","inactive since Dec 2019, according to founder's LinkedIn page (Patrick, 1/13/2021)",Incorporated in DE. Website isn't active. JL (7/3/20).,"Liquidation, close down",12/1/2019,,
Ram's Nook LLC,,,LLC - Limited Liability,11/21/2017,Jon Espita,Anne Froment,,,1609 Valley Run,Durham,North Carolina,27707,Durham,,,Created to bring fresh and healthy options for concessions to college sporting events. Started with core product at the Dean Dome. 2nd year.,"incorporated NC (Cindy, 2/5/2019)",NC annual report 4/6/19. JL 6/23/19. Dissolved in NC 11/15/19. Facebook page no longer active. Former CEO LinkedIN says he ended tenure 8/2019. (Paarvv Goel) No other info on UNC campus food company. Will deactivate. (JL 7/3/20),"Liquidation, close down",11/15/2019,,
Rate Your Dorms LLC,,https://rateyourdorms.com/,Partnership,11/29/2017,Jasper Brindis,,,,314 Burgwin Wright Way,Cary,North Carolina,27519,Wake,rateyourdorms@gmail.com,,A platform for providing and accessing reviews of dorms on college campuses across the U.S.,,"Company is dissolved on the NC Sec of State site, but the website is still active. JL 7/3/20.","Liquidation, close down",2/4/2020,,
Raw Health,,http://rawhealthproducts.com/,LLC - Limited Liability,6/1/2016,Paul Prithard,Laura Pritchard,,,54 Oakwood Dr,Chapel Hill,North Carolina,27517,Orange,info@rawhealthproducts.com,(919) 914-6403,"We make the world's best all natural, aloe based pain relieving gel that does so much more than relieve pain.","website unavailable and LLC dissolved as of 1/31/2022, check again in 2023 (Patrick, 6/29/2022). The website is inactive, NC SoS status as ""Dissolved"". (MacKenzie, 6/16/23)",NC Annual Report 3/14/19. Jen Lai 6/23/19. Annual report 3/12/20. (JL7/3/20).,"Liquidation, close down",1/31/2022,,
REALTROMINS Inc,,http://www.realtromins.com/,C Corporation,4/25/2007,Keith Kocis,Daniel J Kocis Jr,Keith Kocis,,507 Highgrove Dr,Chapel Hill,North Carolina,27516,Orange,kocismd@realtromins.com,(919) 880-4041,"Realtromins develops advanced medical devices that provide an early warning to track vital changes in critically ill or hospitalized patients, identifying high-risk individuals to facilitate immediate changes in medical management, improve patient safety and outcomes, and reduce health care costs.","License terminated, per Jackie Quay, 1/4/2017 incorporated DE, then NC, NC incorporation suspension 5/14/2013, remained DE website available, NC registration suspended on 5/14/2013 but still active according to founder's LinkedIn (Patrick, 6/29/2022). Active website, still active on founder's linkedin (Tiffany, 7/25/23). NC SoS status is ""Multiple"", suspended in 2013, still posted on founder's linkedin, website inactive ( John 5/20/24).",,"Liquidation, close down",5/14/2013,,
RecruitRef,,https://www.recruitref.com/,LLC - Limited Liability,2/1/2018,Van Hatchell,,,,7515 Kepley Rd,Chapel Hill,North Carolina,27515,Orange,van@recruitref.com,(919) 357-3520,RecruitRef is like LinkedIn for high school athletes that want to play their sports in college.,"registration active but no AR '21 or '22 filed yet (Patrick, 6/29/2022)","NC annual report 11/25/19. JL 7/4/20. AR 12/29/20- JL. The website is active, NC SoS status as ""Current - active,"" latest annual report 8/2/2022. Address and contact information are correct. (Mackenzie, 6/16/23) NC Secretary of State website status is ""Current-Active"", NC Annual Report 1/19/24, active website (John 5/20/24).",,,,
Re-Dazzle,,,C Corporation,6/17/2011,Eva-Michelle Greene,Michael Greene,,,,Chapel Hill,North Carolina,,Orange,,,"""Re-Dazzle is a credible online platform for buying and selling previously-loved jewelry. "" ""Re-Dazzle is a credible, online market for jewelry enthusiasts who demand the utmost in quality and security in exchanging their treasures. Unlike other sites, Re- Dazzle uses certified American Gem Society jewelers for authentication and logistical services to gain consumers? trust. Re- Dazzle provides a trusted method for both buyers and sellers to maximize the value and spirit of each piece of jewelry. ""Re- Dazzle?s website is the hub for the online jewelry transactions. Using both B2B and B2C channels of distribution, Re-Dazzle builds networks, relationships, and revenue streams through four main components; buyer, seller, AGS Jeweler, and Re- Dazzle. A seller will take their unwanted jewelry to an AGS certified jeweler who, for a fee dependent on the piece?s estimated value, will authenticate and evaluate the piece and place it on the website. A buyer will purchase the piece from the website for the list price. After receiving the payment from the buyer, Re- Dazzle will send payment less commission to the seller, and split the commission (based on a tiered structure) with the retail jeweler."" (Carolina Challenge 2011 Participants spreadsheet, 9/2/15)",incorporated NC; ADM Dissolution NC 10/23/2013,,"Liquidation, close down",10/23/2013,,
Redbud Labs Inc,Redbud Labs; Rheomics Inc,http://www.redbudlabs.com/,,10/14/2010,Richard Spero,Michael Murphy,Richard Superfine,,400 Park Offices Dr 301,Research Triangle Park,North Carolina,27709,Durham,info@redbudlabs.com,(919) 537-9753,"RedBud Labs is a MEMS and microfluidics technology company that manufactures actuated surface-attached posts (ASAP) for used in microfluidics applications. These posts bend in the presence of a magnetic field and enable small volume sample collection, mixing, processing and analysis.","Another address: PO Box 485 Chapel Hill, North Carolina 27514 United States Incorporated DE Redbud Labs as of 5/2016; was Rheomics Inc (no NC or DE incorporation paperwork for Redbud found as of 6/1/2016 by Cindy, but website updated), registration active, 2022 AR filed (Patrick, 6/29/2022) Per Cindy: I had to create ICS example/projection metrics during its strategic planning some years ago. They are examples of interdisciplinary founded startups, not ICS per se.","NC annual report 1/28/19. JL 6/23/19. Annual report 1/9/20/ (JL 7/4/20). Annual Report 1/12/21- JL. The website is inactive, NC SoS status as ""Current - active,"" latest annual report 1/10/2023. Address and contact information are correct. (Mackenzie, 6/16/23) NC Secretary of State website status is ""Current-Active"", NC Annual Report 1/9/24, active website (John 5/20/24).",,,,
Red Wolf Organics,Red Wolf Organics CSA (Community Supported Agriculture),http://redwolforganics.wixsite.com/farm,,1/3/2015,Silvan Goddin,,,,,Chapel Hill,North Carolina,27516,Orange,redwolforganics@gmail.com,(919) 704-5356,"""We are a one-acre vegetable farm in Orange County, NC. All of our vegetables are grown organically, without the use of synthetic pesticides or fertilizers."" (website, 11/14/2016)","no legal incorporation found; date approximate (Cindy, 3/13/2018) posted on Facebook page on 1/12/2017: ""Please note that Red Wolf Organics is now closed due to our move to Pennsylvania. We hope to re-establish it on our own land some day in the future, but for now thanks to all for your support and encouragement!""",,"Liquidation, close down",1/12/2017,,
Refugee Community Partnership,"Chapel Hill-Carrboro Human Rights Center, Inc.",https://refugeecommunitypartnership.org/,501c,10/31/2008,Asif Kahn,Madison Hayes,,,117 West Main Street,Carrboro,North Carolina,27510,Orange,info@refugeecommunitypartnership.org,(919) 590-5910,"We are a group of students and community members dedicated to improving the lives and protecting the rights of refugee families through educational programs, raising health awareness, and providing legal aid services in order to promote self-sufficiency and community empowerment.","no incorporation data, but website is active; if incorporates, will be 6/29/2015 no incorporation found 4/2017 (Cindy, Huan, 5/15/2017), no incorporation but website still up (Patrick, 6/8/2018), registration active, 2022 AR filed (Patrick, 6/29/2022) EIN: 26-3608741 no updates since 2022 - if nothing in 2024, then will mark inactive - Cindy, 6/5/2024","Incorporation data from NC Sec of State registration. Jen Lai 7/8/19 The website is active, NC SoS status as ""Current - active,"" latest Form 990 2019. Address is correct. (Mackenzie, 6/17/23) ""Current- Active"" on NC SoS website, EIN: 26-3608741, form 990 filed 2021, website active (John 5/20/24).",,,,
Regado Biosciences,,http://www.regadobio.com,C Corporation,1/9/2002,Douglas H Gooding,,,,1307 Person St,Morrisville,North Carolina,27703,Wake,,(919) 596-8888,"Regado Biosciences, Inc., a biopharmaceutical company, engages in the discovery and development of aptamer-based, antidote-controlled therapeutics. It provides REG1 that is used in patients suffering from acute coronary syndrome who undergo coronary revascularization procedures - including coronary artery bypass grafting and percutaneous coronary intervention.","incorporated NC Co-founded by Duke and UNC. company history at http://www.biocentury.com/Archives/innovations/2009-10-15. Christopher Rusconi and Bruce A. Sullenger, Duke, were co-founders. Douglas Gooding, KFBS alum of 2000, was also a co-founder, according to that source and SEC filing (investors' right agreement 2012). (Pam, 11/3/2016) Second Exit via acquisition by Tobira Therapeutics, Inc. in 2015.",,IPO,8/22/2013,,
ReliaSolve LLC,,http://www.reliasolve.com/,LLC - Limited Liability,10/27/2014,Russell Taylor,,,,2301 Lamont Norwood Road,Pittsboro,North Carolina,27312-7003,Chatham,info@reliasolve.com,(919) 960-0966,"""ReliaSolve is a North Carolina LLC founded in 2014 by Russell and Michelle Taylor to provide technology consulting, development, and project management services.""","incorporated NC; annual report filed 3/20/271 NC (Cindy, 4/13/2017), registration active, 2022 AR filed (Patrick, 6/29/2022)","NC Annual report 3/20/19 JL 6/23/19. Annual report 4/8/20. (JL 7/3/30). AR 3/13/21- JL. The website is active, NC SoS status as Current - active, latest annual report 5/10/2023. Address and contact information are correct. (Mackenzie, 6/17/23) NC Secretary of State website status is ""Current-Active"", NC Annual Report 3/31/24, active website (John 5/20/24).",,,,
RemedEase Inc,,,C Corporation,8/4/2005,Amy Dianne Rix,,,,5004 Butternut Rd,Durham,North Carolina,27707,Durham,remedease@gmail.com,(919) 510-5123,"Durham, NC-based RemedEase offers medical devices that stop nose bleeds without interrupting normal breathing or activity.",,,"Liquidation, close down",9/28/2015,,
Remedy Alliance For The People,"Opioid Safety and Naloxone Network Buyers Club, Remedy Alliance",https://remedyallianceftp.org/,501c,9/12/2022,Nabarun Dasgupta,,,,"2930 Shattuck Avenue, #304",Berkeley,California,94703,,info@remedyallianceftp.org,(510) 356-4496,"""We ensure harm reduction programs have sustainable & equitable access to low-cost naloxone for distribution in their communities."" (Remedy Alliance/For The People website, 8-2-22)","From Donate tab on website, ""Remedy Alliance incorporated as a non-profit* in November 2021. We are currently in the process of applying for federal 501(c)(3) status."" ""We are getting ready to launch in July 2022!"" ""*Our 501(c)(3) status is a work in progress, so we will not be able to supply documentation for a tax deduction if you make a donation at this time."" (8-3-22, Tiffany)","DE inc and website active (Patrick, 2/28/23) The website is still active, still no information found on IRS. (Juliana, 6/17/23) ""Remedy Alliance"" registered in DE, file no. 6366378, registered on IRS website, EIN: 87-3486445, form 990-EZ filed 2021, website active, updated address (John 5/20/24).",,,,
Renovion Inc,The Repairion Group; Repairion,http://www.renovion.com/,,6/18/2013,Carolyn Durham,Dan W Copeland,David Henke,Roland Arnold,900 Martin Luther King Jr Blvd Suite A,Chapel Hill,North Carolina,27514,Orange,carolyn@renovion.com,(919) 321-1555,Renovion is a pre-clinical stage pharmaceutical company with a therapy for chronic inflammatory airway diseases.,"registration active, 2022 AR not yet filed (Patrick, 6/29/2022)","Annual report 2/28/19. JL 6/23/19. Annual report 2/23/21- JL. The website is active, NC SoS status ""Current - active,"" latest annual report 10/19/2022. Address is correct and phone number is updated. (Mackenzie, 6/17/23) NC Secretary of State website status is ""Active- Not Current"", NC Annual Report 3/31/24, active website (John 5/20/24). Google lists phone as (919) 240-7034.",,,,
Rent A Goat LLC,,rentagoat.com,LLC - Limited Liability,5/9/2013,Matt Richmond,,,,173 1/2 E Franklin,Chapel Hill,North Carolina,27514,Orange,,(919) 475-3612,"Rent A Goat rents goats to property owners for clearing invasive weeds, grass, and other unwanted plants by using their eco-friendly solution instead of regular machinery or harmful chemicals.",incorporated NC; ADM dissolution NC - last annual report was 8/27/2015,Closed 2/2/17 but site is still active. - Jen Lai 7/12/19,"Liquidation, close down",2/2/2017,,
RentalTaxTool LLC,,https://rentaltaxtool.com/,LLC - Limited Liability,3/26/2014,Edward Hill,,,,321 West Rosemary,Chapel Hill,North Carolina,27516,Orange,,,Rental Tax Tool is an online solution that allows vacation property owners to quickly and easily pay occupancy taxes on their rentals.,incorporated NC; dissolution NC by founders 4/21/2016,,"Liquidation, close down",4/21/2016,,
RepSpark,"RepSpark Systems, LLC",http://www.repspark.com,LLC - Limited Liability,11/28/2007,Edward Howard,,,,751 S. Weir Canyon Rd #157/509,Anaheim,California,92808,,success@repspark.com,,"RepSpark is a B2B wholesale eCommerce platform that serves 150+ apparel, footwear, and sporting goods manufacturers selling into more than 40,000 retail organizations.",Registered in CA.,"CA registration and website active (Patrick, 2/28/23) The website is active, CA SoS status active, address updated. (Mackenzie, 6/17/23) Registered in CA, website active, email/address updated (John 5/20/24).",,,,
Request It Inc,,https://www.linkedin.com/company-beta/10786754/,C Corporation,9/4/2015,Jim Kelly,Jared Wuliger,,,6300 Dello St,Durham,North Carolina,27712,Durham,,,"""Request It! leverages the power of YOU, and the public. You can request, ask, complain, suggest, and vote on anything from anyone anywhere and collaborate with friends, colleagues, and the public. If you have a favorite Request that you are passionate about, then make sure you submit or vote for it! The popularity of an Idea - measured through votes and shares - is what helps the receiver understand what matters most to their fans and supporters."" (from LinkedIn Profile of founder, 5/23/2017)",incorporated NC; annual reports 6/12/2017 founder Linkedin profile indicates closure in March 2018,LinkedIn website not active. No other info nor websites found. NC Sec State says status is dissolved on 6/24/19. Jen Lai 7/12/19,"Liquidation, close down",6/24/2019,,
Residential Services Inc,RSI,http://www.rsi-nc.org/,501c,6/1/1977,,,,,111 Providence Rd,Chapel Hill,North Carolina,27514-2229,Orange,,,"""RSI provides living options and related supports to people of all ages with intellectual and developmental disabilities. RSI promotes quality of life by maximizing self-determination, development of independent living skills, community involvement, meaningful social roles, and socially responsible behavior."" (website, 6/15/2022)","EIN: 56-1101520 incorporation date estimated, founded 1974 guessed at faculty/staff: ""UNC professionals"" per website (Cindy, 6/15/2022)","The website is active, NC SoS status as ""Current - active,"" latest Form 990 2020. Address is correct. (Mackenzie, 6/17/23) ""Current- Active"" on NC SoS website, EIN: 56-1101520, form 990 filed 2022, website active but login protected (John 5/20/24).",,,,
Resistor Brews LLC,,https://www.facebook.com/resistorbrews/,LLC - Limited Liability,7/6/2017,Rajeev Rajendran,,,,2505 Foxwood Drive,Chapel Hill,North Carolina,27514,Orange,,,"""Resistor Brews makes kombucha brewed in unique flavors to be distributed in grocery stores, coffee shops and restaurants."" (NC IDEA, 6/28/2018)",,"NC Sec of State says status of company is ""dissolved"". FB page deactivated. Founder's linked in page says business ended 12/2018. https://www.linkedin.com/in/rajeev-rajendran-523255141/ (JL 7/4/20).","Liquidation, close down",10/11/2019,,
Resound Media LLC,Resound Magazine,http://resoundmagazine.com/,LLC - Limited Liability,11/29/2012,Catherine Elizabeth King,,,,321 West Rosemary,Chapel Hill,North Carolina,27516,Orange,info@resoundmagazine.com,,"Resound Magazine is a national digital music magazine network that covers college community music scenes through locally focused, student-run branches. Resound offers the local relevance and national perspective that music enthusiasts demand, all provided by the nation's top student journalists.",incorporated NC; ADM Dissolution NC 1/14/2016,,"Liquidation, close down",1/14/2016,,
Resultid,"Resultid, NanoVest Inc, Nanovest",https://www.resultid.ai/,C Corporation,1/20/2017,Aditya Badve,Sifron Benjamin,,,1207 Talbot Place,Durham,North Carolina,27703,Durham,team@resultid.com,(586) 646-8378,"""About Resultid: We believe that the true power of data lies in its ability to unlock insights that lead to informed decisions. With a deep commitment to innovation, we specialize in transforming unstructured text data into actionable intelligence. ""Our Natural Language Processing (NLP) technologies and advanced Artificial Intelligence (AI) enable us to decode the nuances of language and discover valuable patterns within qualitative and quantitative data. ""At Resultid, our mission is to empower enterprises with the knowledge they need to drive exceptional outcomes."" (website, 8/2/2024)","Incorporated DE 5/7/2021 as Resultid Inc - Cindy, 8/2/2024 incorporated NC Resultid (changing name in 2021?) (Cindy, 2/12/2021), registration active, 2022 AR filed (Patrick, 6/29/2022) Per Cindy: I had to create ICS example/projection metrics during its strategic planning some years ago. They are examples of interdisciplinary founded startups, not ICS per se.","NC Annual report 4/3/19- JL. Still registered as Nonovest Inc in NC Sec State, Annual Report 7/13/21, Resultid is new name-JL. The website is active, NC SoS status as ""Current - active,"" latest annual report 3/4/2022. Address and contact information are correct. (Mackenzie, 6/17/23) NC SoS status is ""Revoked"", destruction filed 2/17/23, website active/url updated, email updated (John 5/20/24).",,,,
RethinkH2O LLC,Rethink H2O Solutions Inc,http://www.re-thinkh2o.com/,LLC - Limited Liability,8/17/2012,Jim Siplon,Christopher Tuffli,,,203 Mel Oaks Drive,Chapel Hill,North Carolina,27516,Orange,info@re-thinkh2o.com,(919) 904-7188,"RethinkH2O helps water-intense industries such as automobile and textile manufacturers, hospitals, and the hospitality industry identify and address their unique water costs, challenges, and opportunities.","incorporated NC; annual report 4/11/2017, dissolved as of 6/15/2021 but website still active (Patrick, 6/29/2022). The website is active, NC SoS status as ""admin. dissolved"", still active according to LinkedIn. (Mackenzie, 6/17/23) Website is active, LinkedIn shows active, but no activity in several years (NexisUNI), dissolved by state - marking inactive - Cindy, 8/2/2024","Annual report 2/25/19 JL 6/23/19. Admin Dissolution on 6/15/21 on NC Sec State, but website still active- JL. Admin Dissolution on 6/15/21 on NC Sec State, but website still active (John 5/20/24).",,,,
Reveal Genomics,Reveal Genomics SL,https://www.reveal-genomics.com/,Other,9/16/2020,Charles Perou,,Charles Perou,,"Carrer de Villarroel, 170. Escala 2. Planta 5",Barcelona,,,,info@reveal-genomics.com,,"Research and development of biomarkers for the diagnosis, prognosis and epidemiology of cancer","Spain registration active, NIF B02641298 (Patrick, 6/29/2022)","The website is active, Spain registration active. (Mackenzie, 6/17/23) ""Current"" on Spain website, website active, zipcode added (John 5/20/24).",,,,
Reveal Mobile,,http://www.revealmobile.com,C Corporation,5/25/2012,Brian Handly,,,,3344 Hillsborough St #100,Raleigh,North Carolina,27607,Wake,info@revealmobile.com,(919) 573-9701,"Reveal Mobile provides location-based marketing and analytics. Customizable reporting helps advertisers and agencies easily understand the audiences that visit the locations they care about, and the profile of that audience. A powerful user interface makes it easy to build location-based audiences and then reach them through digital advertising and social media. Post-campaign reporting simplifies the process of understanding the increase in foot traffic as a result of the campaigns. The company?s privacy-compliant approach has earned the company membership in the Network Advertising Initiative, undergoing annual privacy certifications. (LinkedIn, 05/04/2021)",,,,,,
Reveris Therapeutics,,www.reveris.com,,6/10/2014,Leslie V Parise,Tina Leisner,Leslie V Parise,,301 Jewell Dr,Chapel Hill,North Carolina,27516,Orange,,(919) 923-3465,Reveris is a pre-clinical stage pharmaceutical company developing novel therapeutics for triple negative breast cancer.,"Categorized as UNC Technology by OTC/Carment, 7/22/2024, given NEO program participation; NEO 6/10/2014 NEO but no UNC IP license as of 8/26/2015 (Cindy, 8/26/2015) IP license completed founder Leslie Parise taking new position at Univ. of Vermont (promotion) and will not have time for her startup (3/16/2020) agreement ended in BLUE, last annual report with state of NC was 1/29/2020; exit date estimated (Cindy, 11/9/2021) Per Cindy: I had to create ICS example/projection metrics during its strategic planning some years ago. They are examples of interdisciplinary founded startups, not ICS per se.",NC annual report 3/25/19. JL 6/23/19. 1/29/20 (JL 7/4/20). Website inactive and no new AR- 8/3/21 JL.,"Liquidation, close down",6/30/2021,,
REVIAN Inc,PhotonMD Inc,https://revian.com/,C Corporation,12/2/2016,F Neal Hunter,,Mark Schoenfisch,,4222 Emperor Blvd #470,Durham,North Carolina,27703,Durham,info@photonmd.com,(919) 939-7715,"""PhotonMD is a medical device company focused on identifying and developing natural, chemical free, non-UV containing light technologies that will enable the treatment of chronic diseases. Our products will treat various health conditions using Modulated Light Therapy (MLT ) technology. MLT is a proprietary unique application of specific wavelengths of light that play an important role in unlocking key elements in human physiology. One of the keys to modulating the immune system is the power to control nitric oxide (NO) and reactive oxygen species. PhotonMD uses innovative, precision photomedicine devices to create safe, therapeutic solutions for aesthetic, autoimmune, inflammatory diseases and other conditions susceptible to light-based healing."" (website, 2/28/2019)","registration active, 2022 AR filed (Patrick, 6/29/2022)","Incorporated in NC too and recent AR 3/30/21- JL. The website is active, NC SoS status as ""Current - active,"" latest annual report 4/18/22. Address and contact information are correct. (Mackenzie, 6/17/23) ""Current- Active"" on NC SoS website, AR filed 5/8/24, website active (John 5/20/24).",,,,
Revibe Technologies,"FokusLabs Behavioral Solutions, Inc.; Dtx Research",https://revibetech.com/,C Corporation,6/23/2016,Rich Brancaccio,,,,"3331 Heritage Trade Drive, Suite 101",Wake Forest,North Carolina,27587,Wake,support@revibetech.com,(919) 521-8444,"Revibe Connect is a vibration-reminder watch that tracks focus, attention, and exercise for students, which as part of a healthy lifestyle may help living well with ADHD.",,,,,,
