Kids Code,Savannah Kids Code,savkidscode.org,,1/1/2015,Angelina P Patel,,,,,Chapel Hill,North Carolina,,Orange,savkidscode@gmail.com,,"Kids Code is a social venture that is striving to making computer science more accessible for students in low income communities and under resourced schools. In a time when technology plays a role in all aspects of our lives, it has become imperative that students are prepared to enter a world where understanding technology is a necessity. Kids Code aims to provide code education to students in grades eighth through twelfth by delivering a project based curriculum through a three week summer intensive program. This intensive will provide students with hands on opportunities to create a website, game, etc, and then present at a STEM showcase. In order to reach students from low income communities, Kids Code is implementing a sponsorship model in partnership with local STEM teachers. Teachers at local schools will be able to nominate students passionate about computer science to attend our program free of charge. Furthermore, Kids Code hopes to break a few of the stereotypes that surround the computer science field. One misconception that we hope to attempt to break at is that coding is often viewed as a solitary act. Is is important for us as coding program to foster a collaborative space. In order to amplify collaboration, we hope to incorporate a team structure into our project based curriculum. Kids Code hopes to establish programs throughout the state of North Carolina and Georgia. Kids Code initially began in Savannah, Georgia during my time in high school as Savannah Kids Code. Today, the program continues to offer free coding workshops on Saturdays at one of the branches of the Savannah Public Library system. Kids Code hopes to grow these simple Saturday workshops into a social venture that bridges the gap in code education around the country.","Founded prior to Angelina Patel's (founder's) starting as a student at UNC, but part of CUBE 4.0 cohort which makes it UNC Assisted Non-profit? Fiscally sponsored? need info (Cindy, 5/23/2018) Ended July 2022 per founder's LinkedIn profile - marked inactive - Cindy, 6/5/2024","Incorporation data and address not found, but website is active. Operations in Chapel Hill and Savannah. JL (6/23/20). The website is not working, still no incorporation information found, the company is still active according to the founder's linkedIn, 7-5-22-Tiffany No incorporation data in NC or DE, but website active and founder's linkedin suggests company is active (Juliana 6/9/23) NC Incorporation not found on SoS website, founder works for Microsoft now per her LinkedIn, so company likely not active. No active website (John 4/19/24).",,,,
KindHeart Inc,KindHeart LLC,https://www.kindheart.com/,C Corporation,2/26/2010,W Andrew Grubbs,Richard H Feins,Richard H Feins,W Andrew Grubbs,1201 Raleigh Road SUITE 102,Chapel Hill,North Carolina,27517,Orange,sales@kindheart.com,(919) 267-2122,"KindHeart is a medical-simulation company specializing in surgery simulation systems that use real animal tissue, fully animated surgical simulators.","incorporated NC both as LLC & Inc, converted to Inc; annual report NC 12/19/2016 Mailing Address: 1830 Fordham Blvd Suite 91B Chapel Hill, NC 27514 CONFIDENTIAL QUESTION: acquired in 2021?","Annual report 3/21/19. JL 7/13/19. Annual report 4/13/20. JL 6/23/20. AR 4/29/21, converted to LLC 5/7/21- JL. The website is active, NC Sec State website status is ""Current - Active"", 7-5-22 - Tiffany. Current - Active on NC Site, NC Annual Report Filed 4/5/23, website active (Juliana, 5/24/23) NC Secretary of State website status is ""Current-Active"", NC Annual Report Filed - 4-11-24, active website, 4-19-24 - John",,,,
Kinethics Inc,,http://www.customkinethics.com/,C Corporation,10/13/2015,Abby Reimer,Hannah Wang,,,321 W Rosemary St,Chapel Hill,North Carolina,27516,Orange,,,A culturally-specific and interactive compliance training service that provides exclusive employee feedback regarding the ethical status of the company,"incorporated NC; annual report filed NC 4/10/2017 Per Cindy: I had to create ICS example/projection metrics during its strategic planning some years ago. They are examples of interdisciplinary founded startups, not ICS per se.",Website is not active. Status of company on NC Sec of State is dissolved. Jen Lai- 6/16/19,"Liquidation, close down",11/26/2017,,
Kinetik Simulation,Kinetik Simulation Limited,http://kinetiksimulation.com/,LLC - Limited Liability,3/4/2022,Christina Yi,David Hughes,,,7 Davis Love Dr,Chapel Hill,North Carolina,27517-9002,Chatham,admin@kinetiksimulation.com,(919) 928-5483,"Kinetik delivers revenue growth through go-to market optimization software to determine resource allocation and productivity drivers across channels, functions, and markets. Our visual approach enables an executive understanding of complex operational processes.",,"The website is active, NC Sec State website status is ""Current - Active"", 7-5-22 - Tiffany. Current - Active on NC Site, NC Annual Report Filed 1/17/23, website active (Juliana, 5/22/23) NC Secretary of State website status is ""Current-Active"", NC Annual Report Filed - 4-2-24, active website, 4-19-24 - John.",,,,
KinoDyn Inc,,http://www.kinodyn.com/,,2/28/2013,Michael Dial,Lee M. Graves,Gary L. Johnson,Jian Jin,4016 Genetic Medicine Bldg 120 Mason Farm Rd,Chapel Hill,North Carolina,27599,Orange,,(408) 497-3262,"KinoDyn is a cancer drug discovery company using a proprietary multiplexed inhibitor bead/mass spectroscopy platform that simultaneously maps and quantifies important cellular enzymes and kinases to discover new drugs and drug combinations. KinoDyn is focused on difficult to manage cancers including triple negative breast cancer (TNBC), pancreatic cancer, drug-resistant leukemias and glioblastoma.","Active - with NCSU; listed on OTD and ESOP web sites (Cindy, 10/21/2014). Founded 2013. Founding School is also School of Medicine Founders: Gary L Johnson; Jian Jin; Lee M Graves Terminated license in March 2017, dissolved company (incorporated NC) - Cindy & OCED mtg 3/27/2017 Per Cindy: I had to create ICS example/projection metrics during its strategic planning some years ago. They are examples of interdisciplinary founded startups, not ICS per se.",,"Liquidation, close down",5/19/2017,,
Kliink,,http://kliink.org/,501c,7/3/2012,Nikhil Jyothinagaram,Kevin Jang,,,173 1/2 E Franklin,Chapel Hill,North Carolina,27514,Orange,,(919) 518-4827,Kliink connects educational NGOs (non-governmental organizations) across the globe with donors via social media.,"NC non-profit website down, no Form 990 info (Cindy, 6/29/2018) Founder's LinkedIn profile indicates closed down 5/15 also received Bryan Social Innovation grant, 2014 Per Cindy: I had to create ICS example/projection metrics during its strategic planning some years ago. They are examples of interdisciplinary founded startups, not ICS per se.",,"Liquidation, close down",5/30/2015,,
KL Medical LLC,,http://www.klmedical.org/home.html,LLC - Limited Liability,2/10/2010,Andy Kiser,Mark Landers,,,68 Pinewild Drive,Pinehurst,North Carolina,28374-9734,Moore,,(910) 295-1603,KL Medical is developing minimaly invasive devices for cardiac surgery.,"incorporated NC, annual report NC 3/29/2017, 4/6/2018, 3/17/2019","Website is not active. NC annual report filed 3/17/19. Jen Lai 6/15/19. Website not active second year, but NC annual report 4/15/20 (JL 6/23/20). Website not active, but NC annual report 4/17/21- JL. The website is still not active, NC Sec State website status is ""Current - Active"", NC AR - 4-15-22, 7-5-22 - Tiffany. Current - Active on NC Site, NC Annual Report Filed 4/18/23, website active (Juliana, 5/22/23) NC Secretary of State website status is ""Current-Active"", NC Annual Report Filed - 3-29-24, website not active, 4-19-24 - John.",,,,
KnotworkApp Inc,IntroStellar,http://www.knotworkapp.com/,,3/20/2015,William Bricker,,,,,San Francisco,California,,,info@knotworkapp.com,,"""Knotwork is a mobile professional networking platform focused on connecting people through personal introductions. It serves to reduce the friction inherent in this process through 3 pillars: karma, data, and purpose. Hinge meets Mint.com for professionals, Knotwork offers measurable, passive yet purposeful networking."" (LinkedIn, 1/11/2016)","incorporated DE became Introstellar??? (Cindy, 6/29/2018)",Website is not active. Jen Lai 6/16/19,"Liquidation, close down",4/1/2017,,
KNOW Bio LLC,,https://www.knowbiollc.com/,LLC - Limited Liability,12/16/2015,F Neal Hunter,Nathan Stasko,Mark Schoenfisch,,615 Davis Dr # 800,Morrisville,North Carolina,27560,Durham,press@knowbiollc.com,(919) 321-1726,"Know Bio, a spin-off of Novan, works to develop cystic fibrosis treatments including a nitric oxide technology. It also develops light-based medical devices and therapeutic solutions for aesthetic applications, chronic inflammatory diseases, and other conditions susceptible to light-based healing.","incorporated NC, annual report NC 4/15/2016","Annual report filed 4/8/19. Jen Lai 6/16/19. AR 3/19/21- JL. The website is active, NC Sec State website status is ""Current - Active"", NC AR - 4-18-22, 7-5-22 - Tiffany. Current - Active on NC Site, last NC Annual Report Filed 4/18/22, website active (Juliana, 5/24/23) NC Secretary of State website status is ""Current-Active"", NC Annual Report Filed - 4-8-22, website active, 4-19-24 - John. Address updated.",,,,
Knowledge Well Inc,KnowledgeWell,http://www.knowledgewell.org/,501c,6/1/2005,Aaron Smith,,,,PO Box 2811,Chapel Hill,North Carolina,27515-2811,Orange,info@knowledgewell.org,(626) 532-7862,"""KnowledgeWell, a public US 501c3 tax exempt not-for-profit organization, was founded in 2005 by a group of UNC Business School MBA's inspired to share their business capabilities with the world and to deliver expertise to emerging and under-resourced areas. KnowledgeWell relies on a strong team of companies and individuals who are motivated to transform the barriers faced by under-resourced nations into opportunities for successful business enterprise. Often described as a ?Doctors without Borders? concept for business professionals, its goals are to enable nations to become more self-sufficient, increase their visibility in the global marketplace and create awareness of sustainable, environmentally friendly business practices."" (website, 7/23/2019)","started in 2005, 501c ruling in June 2008, EIN 20-4026318 Mailing Address: 4101 Lake Boone Trail, Suite 300 Raleigh, NC 27607","The website is active, NC Sec State website status is ""Current - Active"". IRS website lists most recent Form 990-N filed for Tax Year 2020, 7-5-22 - Tiffany. Current - Active on NC site, last IRS tax filing is from 2022, website active (Juliana, 5/16/23) ""Current- Active"" on NC SoS website, EIN: 20-4026318, Form 990 filed 2022, active website (John 5/14/24).",,,,
Krsor,,www.krsor.com,LLC - Limited Liability,8/8/2022,Joseph Driscoll,,,,4030 Wake Forest Rd,Raleigh,North Carolina,27609-0010,Wake,info@krsor.com,,"Krsor helps travelers monetize the unused capacity in their vehicle by connecting them with people who need to ship things along the traveler's route. For shippers, aside from potentially reducing the cost of shipping, this provides: - added convenience by having the traveler come to them to pick up their item - additional control by being able to track the package through the traveler's phone. For travelers, eventually we plan to incorporate the ability to pick up multiple items along a route, thereby potentially completely defraying travel cost and making trips profitable. In time we will pursue integrations with checkout processes on websites like Ebay and Etsy to offer a flexible, trackable, cheaper alternative to existing shipping methods. We will also work to incorporate a standard insurance for each shipment, as well as options for additional insurance coverage.",,"NC registration and website active (Patrick, 2/28/23) Current - Active on NC Site, NC Annual Report Filed 2/22/2023, website active (Juliana, 5/24/23) NC Secretary of State website status is ""Current-Active"", NC Annual Report Filed - 3-16-24, website active, 4-19-24 - John. Email updated.",,,,
KryoSphere Inc,Old Kryo Inc,http://www.kryosphere.com/,C Corporation,2/1/2011,Doug Baker,L. Eric Hallman,,,4222 Emperor Blvd Ste 300,Durham,North Carolina,27703,Durham,info@kryosphere.com,(919) 941-9999,"Durham, NC-based Kryosphere stores and manages active research samples and archived collections through its biorepository. It also provides logistical and management services to academic, pharmaceutical, biotechnology, government, and health care industries worldwide.","incorporated GA, Admin dissolved 12/7/2016 also incorporated NC: Created 9/21/2007, Destruction Filing 4/7/2011, New Creation Filing 2/2/2012, Revoked Certificate of Authority 9/28/2015",,"Liquidation, close down",12/7/2016,,
Kucera Pharmaceutical Company,,,,5/4/2001,Khalid Ishaq,Susan Morris-Natschke,Khalid Ishaq,,200 E 1st St #101,Winston-Salem,North Carolina,27101,Forsyth,,(336) 723-7133,"Kucera Pharmaceutical Company, a pharmaceutical and biotechnology company, engages in developing drugs for the treatment of acute and chronic diseases.","License terminated, per Jackie Quay, 1/4/2017 ESOP website: https://pharmacy.unc.edu/research/entrepreneurial-development-and-global-engagement/economic-development/start-ups-licenses-and-patents/start-ups/kucera-pharmaceuticals-inc",,"Liquidation, close down",7/21/2011,,
KXTbio Inc,,http://www.kxtbio.com/,C Corporation,7/16/2012,Sezgin Ozgur,John Sondek,John Sondek,,710 Market St Ste 31,Chapel Hill,North Carolina,27516,Orange,info@kxtbio.com,(919) 966-7530,"KXTbio is a biotechnology company focusing on the development and application of reagents, assays and drug screening platforms for the study of G proteins and GTPases with the goal of developing small molecule therapeutics targeting protein-protein interactions.","incorporated NC; annual report NC 8/31/2016 (also a KXT Biosciences Inc in DE, but probably not the same firm) Per Cindy: I had to create ICS example/projection metrics during its strategic planning some years ago. They are examples of interdisciplinary founded startups, not ICS per se.","AR filed 5/25/18 - JL 6/16/19. Website not active, NC Sec State status is dissolved on 5/26/21-JL.","Liquidation, close down",5/26/2021,,
LabMojo,,labmojo.com,Partnership,3/23/2020,Michael Marand,jonathan segal,,,,Chapel Hill,North Carolina,,Orange,labmojosearch@gmail.com,,LabMojo generates leads by engaging prospective STEM grad students with a search engine to quickly find labs that fit your preferences.,,"The website is active, no incorporation information found. The company is still active according to co-founder's linkedIn (Tiffany, 7/5/2022) The website is no longer active, and there is no incorporation information. The company is still active according to co-founder's linkedIn. (Mackenzie, 5/24/2023) The website is no longer active, and there is no incorporation information. The company is still active according to co-founder's linkedIn. (John, 5/14/24).",,,,
Last Mile Health,,http://lastmilehealth.org/,501c,8/1/2014,Raj Panjabi,,,,68 Harrison Ave Ste 605 PMB 31738,Boston,Massachusetts,02111-1929,,info@lastmilehealth.org,(857) 449-7322,"""We?re supporting the Government of Liberia to implement a nationwide community health worker program that will bring lifesaving care to the doorsteps of 1.2 million people living in remote communities. As we take on this groundbreaking work, we?re generating evidence of our impact and advocating on a global stage for investment in community health workers."" (website, 12/28/2018)","EIN 26-1401736, MA Sec State ID Number: 261401736","The website is active, IRS website lists most recent Form 990 filed for Tax Year 2020, 7-5-22 - Tiffany. According to LinkedIn they are still active. Website is still active, latest Form 990 filed in 2020. (Mackenzie, 5/24/23) Registered on IRS website, EIN: 26-1401736, form 990 filed 2022, website active and address updated (John 5/14/24).",,,,
"Laughing Monitos, LLC",,Laughingmonitos.com,LLC - Limited Liability,3/1/2023,Judy Batista,,,,772 Millbrook Drive,Pittsboro,North Carolina,27312,Chatham,laughingmonitos@gmail.com,(919) 904-4476,Laughing Monitos offers services for children ages 0-4 years of age in a playgroup setting led by a speech pathologist with the focus of helping children meet developmental milestones in speech and language development.,"""Current- Active"" in NC, AR filed 4/22/24, active website (John 6/4/24).",,,,,
Lead for America,National Lead for America Inc,https://www.lead4america.org/,501c,5/22/2018,Joe Nail,Dylan Russell,,,100 S Market St Suite 2C,Dodge City,Kansas,67202,,info@lead4america.org,(919) 960-1041,"""Lead for America (LFA) aims to recruit, train, and connect as many as possible of our nation's most promising young leaders to strengthen America's civic institutions through a two-year fellowship in local government. ""LFA is innovative for four key reasons: 1) We are building a recruiting apparatus for public service jobs on the campuses of 4-year colleges and universities. 2) We are helping address brain-drain, a nationwide phenomenon in which the high school graduates of rural America and less populated states and cities are able to return home to their communities and build an ecosystem of change makers around them. At least 50% of all placements will be connecting students with their hometown or college community. 3) We are filling a major need for local governments. 35% of the workforce is/will be eligible for retirement in the next decade and 91% of City and County Managers said being able to attract and retain top talent is their biggest challenge in the future. 4) We are providing a technology-based solution to the larger, systemic problem. In addition to the core fellowship, we also will have our application process function as a Common Application, with students not being selected for the fellowship still being matched with a public service position and public service mentor, as well as being connected with others using the Common App who are entering public service in their region.""","Launch application of May 2018 says 501c3 as of May 2018, but could not verify (Cindy, 5/24/2018) (Patrick, 6/8/2018) EIN: 83-1839530","Goes by ""NATIONAL LEAD FOR AMERICA, INC"" JL 6/23/20. The website is active, NC Sec State website status is ""Current - Active"". EIN: 83-1839530, IRS website lists most recent Form 990 filed for Tax Year 2019, 7-6-22 - Tiffany. The website is still active. IRS website lists most recent Form 990 filed for Tax Year 2019, EIN is the same. NC SoS lists status as ""Current-Active"". (Mackenzie, 5/24/23) Incorporated NC non-profit; EIN: 83-1839530, website active, form 990 filed 2021, address updated (John 5/14/24).",,,,
Leading Schools Forward LLC,Leading Schools Forward; Built on Values for Schools,http://www.leadingschoolsforward.org/,LLC - Limited Liability,7/5/2017,Richard Sinclair,,,,451 Crystal Hills Blvd,Manitou Springs,Colorado,80829,Orange,rsincla3@uccs.edu,(919) 525-1954,,"Registered in NC as Leading Schools Forward, LLC Incorporated in Colorado as Leading Schools Forward, LLC on 11/22/2019, 451 Crystal Hills Blvd, Manitou Springs, CO 80829, United States Mailing Address: 105 Saratoga Trail Chapel Hill, NC 27516 Delinquent status in Colorado - marking inactive, Cindy 8/2/2024","Annual report 7/31/18 - JL 6/17/19. Company dissolved in NC on 2/4/20, but website still active. JL 6/23/20.Still active CO (Cindy, 10/7/2020) The website is still active. The company is still active according to contact's linkedIn (Tiffany, 7/6/2022) The website is still active, contact information is correct. Still active according to LinkedIn. (Mackenzie, 5/24/23) NC SoS status ""Admin- Dissolved"", destruction filed 2/4/2020, website active, contact info updated (John 5/14/24). Still active according to founder's linkedin.",,,,
Learning2Thrive Program,"ARCPP; Learning2Thrive Program, Inc.",https://l2tprogram.org/,501c,11/1/2021,William Sibert,,,,1598 Great Ridge Pkwy,Chapel Hill,North Carolina,27516,Orange,,,A startup dedicated to creating a new approach to student emotional intelligence/mental health. A working platform already exists. Our goal is give students the chance to adapt it their own needs.,"Incorporated NC Non - Profit; EIN 87-3377701; Active website - Jenny (1/22/2024) NC Secretary of State website status is ""Current-Active"", EIN: 87-3377701, form 990 not filed, active website, 4-19-24 - John.",,,,,
Learn to Win,LearnToWin Inc,https://www.learntowin.com/,C Corporation,6/6/2018,Aleksander H Seymore,Andrew H Powell,,,805 Veterans Blvd,Redwood City,California,94063,,info@learntowin.com,(909) 414 1295,"""Learn to Win?s software platform unlocks Last Mile Learning for organizations. What is Last Mile Learning? It's the critical operational knowledge unique to every team. Last Mile training drives 80% of job performance, but it's unique to every org and can't be bought off-the-shelf. It lives in your experts' heads. It's taught informally - if at all. How does Learn To Win unlock Last-Mile Learning? Our platform makes it fast and simple for anyone to build a lesson. For learners, our technology incorporates learning science principles proven to make training more engaging and effective. Our mobile-first platform delivers learning in bite-size chunks that are easy to consume in the flow of work. We work with hundreds of customers: Fast-food chains upleveling workers on drive-thru management, NFL teams training on playbooks and scouting reports, tech companies onboarding new engineers, pharmaceutical companies readying sales reps for new product releases, and Air Force pilots drilling on emergency procedures."" (website, 1/15/2024)","incorporated DE 3rd co-founder: Tommy Hatton, https://www.linkedin.com/in/tommy-hatton-18154b141/ Incorpoated DE file 6921378, website active (John 5/14/24).","Founder Sasha Seymore graduated from UNC in 2015, and the company was founded in 2018. Founder Andrew H Powell also graduated from UNC in 2015.",,,,
Leaselytics Inc,Leasalytics Inc,,C Corporation,4/17/2013,Rob Whitley,,,,150 Fayetteville St Suite 2300,Raleigh,North Carolina,27601,Wake,,,"Leaselytics, a SaaS company that provides leasing performance analytics for the apartment industry, allows managers and owners to analyze the leasing performance of their portfolio through an intuitive dashboard, leading to richer insights and smarter decisions.","incorporated NC 4/17/2013 dissolved per founder's linkedin profile (Cindy, 6/29/2018)",,"Liquidation, close down",7/30/2014,,
LED Radiofluidics Corp,LED Radiofluidics,https://www.ledradiofluidics.com/,C Corporation,3/5/2020,Zibo Li,David Nicewicz,Zibo Li,David Nicewicz,"250 Bell Tower Road, Genome Science Building, Room 2244",Chapel Hill,North Carolina,27514,Orange,ledradiofluidics@gmail.com,,"""LED radiofluidic focus on developing new labeling methods and PET probes for the diagnosis and treatment of cancer, cardiac, neurodegenerative disease and others.""","incorporated DE. intends to license UNC IP, will become UNC Technology startup (Cindy, 7/6/2021) CEL signed, confirmed by Chance 10/15/2021 applying for CEL in Oct 2021 (Cindy, 10/11/2021)","No website found, NC Sec State website status is ""Current - Active"", 7-6-22 - Tiffany. NC SoS status ""Current - Active,"" latest annual report 12/31/2022. (Mackenzie, 5/24/23) NC Secretary of State website status is ""Current-Active"", NC Annual Report Filed - 4-11-24, active website, email added (John 5/14/24).",,,,
Lensational,,http://www.lensational.org/,Other,3/1/2013,Bonnie Chiu,,,,"Capital Office Kemp House, 152-160 City Road",London,,,,info@lensational.org,,Lensational is a global social enterprise committed to sharing women?s stories through the transformative power of photography. We equip marginalised women in the developing world with digital cameras and photography training. We are a global team of innovators united by a deep sense of mission to create social change.,"registered non-profit in Hong Kong; registered charity in England and Wales (verified through charitycommission.gov.uk, 12/2/2016); date approximate Founder was in GLOBE program, not KFBS entrepreneurship curriculum London Office Address: Kemp House, 152-160 City Road, London EC1V 2NX","The website is active, UK Charity Number: 1165958, Status: Registered, Reporting Status: Received: On time, 7-6-22-Tiffany The website is still active, Status: Registered, Reporting Status: Received: On time. (Mackenzie, 5/30/23) Registered charity in UK, report ""on time"", status ""registered"", website active (John 5/14/24).",,,,
Leoh.io,,,Sole Proprietorship,3/1/2015,Simon Komlos,,,,,Chapel Hill,North Carolina,,Orange,,,"Chrome (web browser) extension. ""Replace your new tab with a minimalistic and customizable homepage featuring a clock, todo list, weather, bookmarks and much more!"" (website, 7/6/2018)","date of legal structure approximate, and company structure is an educated guess - used Founder's LinkedIn profile and other news sources (Cindy, 7/6/2018) Founder's LinkedIn profile says: ""Leoh.io has been acquired by Noah Kagan (Previously of Facebook & Mint, now founder of AppSumo)."" Verified via interview with Noah Kagan (https://mixergy.com/interviews/sumo-with-noah-kagan/)",,Acquisition,6/30/2017,,
Let's Chip In Inc,,https://letschipin.co/,C Corporation,3/4/2014,Jeff Henriod,,,,321 West Rosemary,Chapel Hill,North Carolina,27516,Orange,,,Let's Chip In is a website and app to help new parents receive group gifts from friends and family for significant purchases such as a baby crib.,"incorporated NC; annual report NC 4/29/2015 appears to be defunct, exit date approximate (Cindy, 6/29/2018)",,"Liquidation, close down",4/30/2016,,
